{
  "executionId": "EXEC-1789297742130",
  "testCaseId": "TC-WF-001",
  "targetId": "TARGET-DEFAULT",
  "buildVersion": "local-build",
  "environment": "local",
  "browser": "Desktop Chromium",
  "startTime": "2026-09-13T11:09:02.130Z",
  "endTime": "2026-09-13T11:09:02.975Z",
  "durationMs": 1106,
  "status": "PASSED",
  "evidence": {
    "screenshots": []
  },
  "oracleEvaluations": [
    {
      "oracleId": "ORACLE-STM-01",
      "isSatisfied": true,
      "explanation": "Trạng thái chuyển dịch từ DRAFT sang SUBMITTED chính xác."
    }
  ]
}