{
  "executionId": "EXEC-1789296890047",
  "testCaseId": "TC-TRANS-001",
  "targetId": "TARGET-DEFAULT",
  "buildVersion": "local-build",
  "environment": "local",
  "browser": "Desktop Chromium",
  "startTime": "2026-09-13T10:54:50.047Z",
  "endTime": "2026-09-13T10:54:51.504Z",
  "durationMs": 1746,
  "status": "PASSED",
  "evidence": {
    "screenshots": []
  },
  "oracleEvaluations": [
    {
      "oracleId": "ORACLE-TRANS-MATH-01",
      "isSatisfied": true,
      "explanation": "Số dư sau chuyển = Số dư trước - 250 - Phí (Thỏa mãn tuyệt đối)."
    }
  ]
}