{
  "executionId": "EXEC-1789297728505",
  "testCaseId": "TC-TRANS-004",
  "targetId": "TARGET-DEFAULT",
  "buildVersion": "local-build",
  "environment": "local",
  "browser": "Desktop Chromium",
  "startTime": "2026-09-13T11:08:48.505Z",
  "endTime": "2026-09-13T11:08:49.240Z",
  "durationMs": 1090,
  "status": "PASSED",
  "evidence": {
    "screenshots": []
  },
  "oracleEvaluations": [
    {
      "oracleId": "ORACLE-TRANS-BOUNDARY-02",
      "isSatisfied": true,
      "explanation": "Giao dịch $0.00 bị từ chối thành công theo đúng Test Oracle."
    }
  ]
}