{
  "executionId": "EXEC-1789297728465",
  "testCaseId": "TC-ATOMIC-001",
  "targetId": "TARGET-DEFAULT",
  "buildVersion": "local-build",
  "environment": "local",
  "browser": "Desktop Chromium",
  "startTime": "2026-09-13T11:08:48.465Z",
  "endTime": "2026-09-13T11:08:50.172Z",
  "durationMs": 1980,
  "status": "PASSED",
  "evidence": {
    "screenshots": []
  },
  "oracleEvaluations": [
    {
      "oracleId": "ORACLE-DOC-NAV-01",
      "isSatisfied": true,
      "explanation": "Trang Installation đã load thành công với đầy đủ mã lệnh cài đặt và tiêu đề chuẩn."
    }
  ]
}