{
  "executionId": "EXEC-1789297728445",
  "testCaseId": "TC-AUTH-001",
  "targetId": "TARGET-DEFAULT",
  "buildVersion": "local-build",
  "environment": "local",
  "browser": "Desktop Chromium",
  "startTime": "2026-09-13T11:08:48.445Z",
  "endTime": "2026-09-13T11:08:49.151Z",
  "durationMs": 961,
  "status": "PASSED",
  "evidence": {
    "screenshots": []
  },
  "oracleEvaluations": [
    {
      "oracleId": "ORACLE-AUTH-01",
      "isSatisfied": true,
      "explanation": "Quyền quản trị viên được xác nhận đầy đủ theo Test Oracle."
    }
  ]
}